{
  "version": "0.1.0",
  "subject": "mathematics",
  "school_stage": "middle_school",
  "curriculum_profile": "it-middle-school-math-transition-2026",
  "typical_year": 1,
  "sequencing_note": "Sequenza tipica TutorLab, adattiva e non prescrittiva. Le nuove Indicazioni 2025 si applicano alle classi prime dall'a.s. 2026/27.",
  "nodes": [
    {
      "id": "math.practice.problem-representation",
      "title": "Rappresentare un problema matematico",
      "strand": "mathematical_practices",
      "typical_year": 1,
      "priority": "gateway",
      "prerequisites": [],
      "objectives": ["Individuare dati, domanda e relazioni rilevanti", "Tradurre una situazione in schema, disegno, tabella o espressione"],
      "mastery_evidence": ["Distingue dati utili e irrilevanti", "Sceglie una rappresentazione coerente", "Spiega il significato delle operazioni usate"],
      "diagnostic_signals": ["Opera sui numeri senza collegarli alla domanda", "Copia tutti i dati senza gerarchia", "Non sa spiegare cosa rappresenta il risultato"],
      "difficulty_levers": ["information_load", "representation_demand", "strategy_selection"]
    },
    {
      "id": "math.practice.estimation",
      "title": "Stimare e controllare la plausibilità",
      "strand": "mathematical_practices",
      "typical_year": 1,
      "priority": "supporting",
      "prerequisites": [],
      "objectives": ["Produrre stime ragionevoli", "Usare ordine di grandezza e confronto per controllare un risultato"],
      "mastery_evidence": ["Riconosce risultati implausibili", "Giustifica una stima con un criterio semplice"],
      "diagnostic_signals": ["Accetta risultati impossibili senza controllo", "Confonde stima e calcolo esatto"],
      "difficulty_levers": ["reasoning_demand", "transfer_distance"]
    },
    {
      "id": "math.practice.measurement-units",
      "title": "Misure, unità e scale",
      "strand": "mathematical_practices",
      "typical_year": 1,
      "priority": "core",
      "prerequisites": ["math.numbers.natural-number-sense"],
      "objectives": ["Leggere e usare unità di misura", "Eseguire semplici equivalenze", "Interpretare scale graduate"],
      "mastery_evidence": ["Associa grandezza e unità appropriate", "Converte misure in casi standard", "Legge correttamente una scala"],
      "diagnostic_signals": ["Tratta unità diverse come intercambiabili", "Applica conversioni meccaniche senza controllo"],
      "difficulty_levers": ["representation_demand", "precision_demand"]
    },
    {
      "id": "math.numbers.natural-number-sense",
      "title": "Numeri naturali: significato, ordine e rappresentazione",
      "strand": "numbers",
      "typical_year": 1,
      "priority": "gateway",
      "prerequisites": [],
      "objectives": ["Leggere, scrivere, confrontare e ordinare numeri naturali", "Rappresentare numeri sulla retta", "Comprendere valore posizionale e ordine di grandezza"],
      "mastery_evidence": ["Confronta numeri senza affidarsi alla sola lunghezza grafica", "Posiziona numeri sulla retta", "Scompone per valore posizionale"],
      "diagnostic_signals": ["Errori nel valore posizionale", "Confronti errati con zeri interni o finali", "Difficoltà a collegare simbolo e posizione sulla retta"],
      "difficulty_levers": ["representation_demand", "precision_demand"]
    },
    {
      "id": "math.numbers.natural-operations",
      "title": "Quattro operazioni con numeri naturali",
      "strand": "numbers",
      "typical_year": 1,
      "priority": "gateway",
      "prerequisites": ["math.numbers.natural-number-sense"],
      "objectives": ["Eseguire con sicurezza le quattro operazioni", "Usare proprietà delle operazioni per semplificare calcoli", "Scegliere tra calcolo mentale, scritto e strumento"],
      "mastery_evidence": ["Calcola con accuratezza", "Riconosce l'operazione coerente con il contesto", "Usa proprietà in modo motivato"],
      "diagnostic_signals": ["Errori sistematici negli algoritmi", "Confusione tra operazione e situazione", "Uso rigido dell'algoritmo anche quando non conveniente"],
      "difficulty_levers": ["process_depth", "strategy_selection", "precision_demand"]
    },
    {
      "id": "math.numbers.numeric-expressions-natural",
      "title": "Espressioni con numeri naturali",
      "strand": "numbers",
      "typical_year": 1,
      "priority": "gateway",
      "prerequisites": ["math.numbers.natural-operations"],
      "objectives": ["Applicare precedenze e parentesi", "Tradurre una sequenza di operazioni in espressione", "Controllare il risultato con stima o calcolo inverso"],
      "mastery_evidence": ["Rispetta precedenze senza guida", "Costruisce un'espressione da un testo semplice", "Sa spiegare l'ordine dei passaggi"],
      "diagnostic_signals": ["Calcolo sempre da sinistra a destra", "Parentesi ignorate", "Espressione corretta ma scollegata dal problema"],
      "difficulty_levers": ["process_depth", "information_load", "reasoning_demand"]
    },
    {
      "id": "math.numbers.powers-natural",
      "title": "Potenze con esponente intero positivo",
      "strand": "numbers",
      "typical_year": 1,
      "priority": "core",
      "prerequisites": ["math.numbers.natural-operations"],
      "objectives": ["Interpretare la potenza come prodotto ripetuto", "Usare la notazione delle potenze", "Applicare proprietà elementari delle potenze"],
      "mastery_evidence": ["Distingue base ed esponente", "Passa tra prodotto e potenza", "Usa proprietà senza confondere somma e prodotto"],
      "diagnostic_signals": ["Moltiplica base per esponente", "Somma esponenti in situazioni non valide", "Confonde potenza di potenza e prodotto di potenze"],
      "difficulty_levers": ["conceptual_novelty", "process_depth", "symbolic_density"]
    },
    {
      "id": "math.numbers.divisibility",
      "title": "Multipli, divisori e criteri di divisibilità",
      "strand": "numbers",
      "typical_year": 1,
      "priority": "gateway",
      "prerequisites": ["math.numbers.natural-operations"],
      "objectives": ["Riconoscere multipli e divisori", "Usare criteri di divisibilità", "Motivare semplici relazioni di divisibilità"],
      "mastery_evidence": ["Distingue multiplo da divisore", "Applica criteri corretti", "Individua divisori senza tentativi casuali"],
      "diagnostic_signals": ["Inversione multiplo/divisore", "Criteri ricordati ma applicati al numero sbagliato", "Ricerca incompleta dei divisori"],
      "difficulty_levers": ["strategy_selection", "reasoning_demand"]
    },
    {
      "id": "math.numbers.prime-factorization",
      "title": "Numeri primi e scomposizione in fattori primi",
      "strand": "numbers",
      "typical_year": 1,
      "priority": "gateway",
      "prerequisites": ["math.numbers.divisibility", "math.numbers.powers-natural"],
      "objectives": ["Riconoscere numeri primi e composti", "Scomporre semplici numeri naturali in fattori primi", "Usare la fattorizzazione come rappresentazione strutturale"],
      "mastery_evidence": ["Produce una scomposizione completa", "Controlla ricostruendo il numero", "Riconosce l'utilità della scomposizione"],
      "diagnostic_signals": ["Fattori non primi lasciati nella scomposizione", "Perdita di fattori ripetuti", "Confusione tra fattori e addendi"],
      "difficulty_levers": ["process_depth", "precision_demand"]
    },
    {
      "id": "math.numbers.gcd-lcm",
      "title": "MCD e mcm",
      "strand": "numbers",
      "typical_year": 1,
      "priority": "gateway",
      "prerequisites": ["math.numbers.prime-factorization"],
      "objectives": ["Calcolare MCD e mcm con strategie diverse", "Distinguere quando usare MCD o mcm in un problema"],
      "mastery_evidence": ["Calcola correttamente", "Sceglie MCD o mcm dal significato del problema", "Spiega la scelta"],
      "diagnostic_signals": ["Regole degli esponenti scambiate", "Sceglie MCD/mcm per parole chiave", "Non collega il risultato al contesto"],
      "difficulty_levers": ["strategy_selection", "transfer_distance", "reasoning_demand"]
    },
    {
      "id": "math.numbers.fraction-meaning",
      "title": "Frazione come parte, quoziente, rapporto e numero",
      "strand": "numbers",
      "typical_year": 1,
      "priority": "gateway",
      "prerequisites": ["math.numbers.natural-operations", "math.practice.measurement-units"],
      "objectives": ["Interpretare frazioni in rappresentazioni diverse", "Collocare frazioni semplici sulla retta", "Passare tra contesto e scrittura frazionaria"],
      "mastery_evidence": ["Riconosce la stessa frazione in modelli diversi", "Comprende frazioni maggiori di uno", "Spiega numeratore e denominatore nel contesto"],
      "diagnostic_signals": ["Frazione vista solo come due numeri separati", "Rifiuto delle frazioni improprie", "Confusione tra numero di parti e dimensione delle parti"],
      "difficulty_levers": ["conceptual_novelty", "representation_demand", "transfer_distance"]
    },
    {
      "id": "math.numbers.fraction-equivalence",
      "title": "Frazioni equivalenti e semplificazione",
      "strand": "numbers",
      "typical_year": 1,
      "priority": "gateway",
      "prerequisites": ["math.numbers.fraction-meaning", "math.numbers.divisibility"],
      "objectives": ["Riconoscere e generare frazioni equivalenti", "Semplificare una frazione", "Collegare equivalenza e posizione sulla retta"],
      "mastery_evidence": ["Genera equivalenti con criterio", "Semplifica fino ai minimi termini", "Giustifica l'invarianza del valore"],
      "diagnostic_signals": ["Modifica un solo termine", "Somma lo stesso numero sopra e sotto", "Semplificazione trattata come cancellazione grafica"],
      "difficulty_levers": ["representation_demand", "reasoning_demand", "precision_demand"]
    },
    {
      "id": "math.numbers.fraction-comparison",
      "title": "Confronto e ordinamento di frazioni",
      "strand": "numbers",
      "typical_year": 1,
      "priority": "core",